{
  "id": "OC-CHATGPT-INTEGRATION-HEARTBEAT",
  "type": "heartbeat",
  "requested_by": "ChatGPT",
  "goal": "Verify task ingestion, push dispatch, runner execution, evidence report, artifact, status update, and evidence commit.",
  "expected_status": "PASS",
  "params": {},
  "safety": {
    "customer_action": false,
    "public_posting": false,
    "paid_ads_change": false,
    "destructive_action": false
  }
}
