{
  "id": "OC-SEARCH-RUNNER-BOOTSTRAP-20260622-07",
  "type": "job_lead_collect",
  "requested_by": "ChatGPT",
  "goal": "Bootstrap the corrected job-search status contract into the OpenClaw runner evidence commit.",
  "expected_status": "FAIL",
  "status": "pending",
  "params": {
    "search_queries": [
      "zzzz-bootstrap-no-such-driver-role-987654321"
    ],
    "seed_urls": [],
    "max_leads": 1,
    "location": "Los Angeles, CA",
    "target_profile": {
      "read_only_research": true,
      "bootstrap_status_patch": true
    }
  },
  "safety": {
    "production_code_change": false,
    "customer_action": false,
    "secrets_required": false,
    "public_posting": false,
    "paid_ads_change": false,
    "destructive_action": false
  }
}
