{
  "id": "MESSENGINFO_DOMAIN_WWW_AUDIT_RERUN_2026-05-13_2",
  "type": "virtual_browser_audit",
  "requested_by": "Sergii",
  "goal": "Force-rerun the Messenginfo browser audit after fixing OpenClaw artifact filename handling. Verify that the OpenClaw workflow no longer fails during artifact upload. Use real Chromium to check apex and www hosts for the Messenginfo USCIS product and capture evidence. Do not change DNS, Vercel, Cloudflare, production code, paid ads, customer data, or public posts.",
  "expected_status": "FAIL",
  "params": {
    "target_origin": "https://messenginfo.com",
    "routes": "/,/ru/services/tps-ukraine/start,https://www.messenginfo.com/,https://www.messenginfo.com/ru/services/tps-ukraine/start",
    "max_attempts": 1
  },
  "safety": {
    "production_code_change": false,
    "customer_action": false,
    "secrets_required": false,
    "public_posting": false,
    "paid_ads_change": false,
    "destructive_action": false
  }
}
