{
  "id": "OC-SEARCH-BOX-TRUCK-LA-20260622-01",
  "type": "job_lead_collect",
  "requested_by": "ChatGPT",
  "goal": "Collect current public job leads for box truck drivers in the Los Angeles area in read-only mode.",
  "expected_status": "PASS",
  "status": "pending",
  "params": {
    "search_queries": [
      "box truck driver jobs Los Angeles",
      "non CDL box truck driver Los Angeles",
      "26 foot box truck driver jobs Los Angeles"
    ],
    "seed_urls": [
      "https://www.indeed.com/",
      "https://www.simplyhired.com/",
      "https://www.ziprecruiter.com/"
    ],
    "max_leads": 5,
    "location": "Los Angeles, CA",
    "target_profile": {
      "commercial_driving_background": true,
      "box_truck_interest": true,
      "read_only_research": true
    }
  },
  "safety": {
    "production_code_change": false,
    "customer_action": false,
    "secrets_required": false,
    "public_posting": false,
    "paid_ads_change": false,
    "destructive_action": false
  }
}
