{
  "id": "OC-OUTREACH-DRAFT-SAMPLE",
  "type": "outreach_draft",
  "requested_by": "Sergii",
  "goal": "Generate Gmail-ready drafts for reviewed leads without sending.",
  "expected_status": "PASS",
  "params": {
    "leads": [
      {
        "company": "Sunset Apartments",
        "role": "Onsite Resident Manager",
        "location": "Los Angeles, CA",
        "public_contact_channel_if_visible": "hiring@example.com",
        "apply_url": "https://example.com/apply"
      }
    ]
  },
  "safety": {
    "production_code_change": false,
    "customer_action": false,
    "secrets_required": false,
    "public_posting": false,
    "paid_ads_change": false,
    "destructive_action": false
  }
}
