{
  "id": "OC-EXAMPLE-COM-AUDIT-20260621-01",
  "type": "virtual_browser_audit",
  "requested_by": "ChatGPT",
  "goal": "Read-only browser connectivity audit for a public HTTPS page",
  "expected_status": "PASS",
  "params": {
    "target_origin": "https://example.com",
    "routes": [
      "/"
    ],
    "max_attempts": 2
  },
  "safety": {
    "customer_action": false,
    "public_posting": false,
    "paid_ads_change": false,
    "destructive_action": false
  }
}
