{
  "id": "OC-SEARCH-BOX-TRUCK-LA-20260622-02",
  "type": "job_lead_collect",
  "requested_by": "ChatGPT",
  "goal": "Verify that OpenClaw returns only concrete public box-truck job listings and rejects blocked or generic pages.",
  "expected_status": "PASS",
  "status": "pending",
  "params": {
    "search_queries": [
      "box truck driver jobs Los Angeles",
      "non CDL box truck driver Los Angeles",
      "26 foot box truck driver Los Angeles hiring"
    ],
    "seed_urls": [],
    "max_leads": 5,
    "location": "Los Angeles, CA",
    "target_profile": {
      "commercial_driving_background": true,
      "box_truck_interest": true,
      "read_only_research": true
    },
    "rerun_nonce": "2026-06-22T21:05:00Z"
  },
  "safety": {
    "production_code_change": false,
    "customer_action": false,
    "secrets_required": false,
    "public_posting": false,
    "paid_ads_change": false,
    "destructive_action": false
  }
}
