{
  "id": "OC-TEMPLATE-VIRTUAL-BROWSER-AUDIT",
  "type": "virtual_browser_audit",
  "requested_by": "ChatGPT",
  "goal": "Read-only official source audit",
  "expected_status": "PASS",
  "params": {
    "target_origin": "https://www.example.gov",
    "routes": ["/"],
    "max_attempts": 2
  },
  "safety": {
    "customer_action": false,
    "public_posting": false,
    "paid_ads_change": false,
    "destructive_action": false
  }
}
