{
  "id": "OC-OPENCLAW-CLI-PROBE-20261016",
  "type": "heartbeat",
  "requested_by": "ChatGPT Mobile",
  "status": "pending",
  "goal": "Verify the GitHub-hosted OpenClaw control path is alive before any DeepSeek secret integration work.",
  "expected_status": "PASS",
  "priority": "P1",
  "created_at": "2026-10-16T16:58:00Z",
  "params": {},
  "safety": {
    "production_code_change": false,
    "customer_action": false,
    "secrets_required": false,
    "public_posting": false,
    "paid_ads_change": false,
    "destructive_action": false
  }
}
